{
    "$schema": "https://go.kicad.org/pcm/schemas/v1",
    "identifier": "com.alsoknownasfoo.spinrender",
    "name": "SpinRender",
    "type": "plugin",
    "description": "KiCad plugin for generating animated PCB renders",
    "description_full": "SpinRender is a KiCad plugin that makes it easy to generate beautiful animated PCB renders directly from your KiCad projects. Create professional showcase videos, GIFs, and image sequences with just a few clicks.",
    "author": {
        "name": "Foo Hoang",
        "contact": {
            "web": "https://alsoknownasfoo.com"
        }
    },
    "maintainer": {
        "name": "Foo Hoang",
        "contact": {
            "web": "https://alsoknownasfoo.com"
        }
    },
    "license": "GPL-3.0",
    "resources": {
        "homepage": "https://github.com/alsoknownasfoo/SpinRender"
    },
    "tags": [
        "spin",
        "render",
        "animation",
        "visualization",
        "video",
        "gif",
        "preview",
        "pcb",
        "presentation",
        "showcase",
        "export",
        "portfolio",
        "demo"
    ],
    "versions": [
        {
            "version": "0.9.1",
            "status": "stable",
            "kicad_version": "9.0"
        }
    ]
}
